{
  "schema_version": "1.0",
  "verdict_id": "verdict-20260709T005739948-ce763555",
  "run_id": "20260709T005739948-ce763555",
  "checkpoint_id": "nav-20260709T005739948-ce763555",
  "state": "pass",
  "unresolved_blocking_count": 0,
  "blocking_finding_ids": [],
  "unsafe_reasons": [],
  "round_count": 1,
  "escalation_ref": null,
  "created_at": "2026-07-09T01:00:26Z"
}