{
  "schema_version": "1.0",
  "verdict_id": "verdict-20260710T181853407-a07ff4ec",
  "run_id": "20260710T181853407-a07ff4ec",
  "checkpoint_id": "nav-20260710T181853407-a07ff4ec",
  "state": "pass",
  "unresolved_blocking_count": 0,
  "blocking_finding_ids": [],
  "unsafe_reasons": [],
  "round_count": 1,
  "escalation_ref": null,
  "created_at": "2026-07-10T18:19:56Z"
}