{
  "schema_version": "1.0",
  "verdict_id": "verdict-20260708T232730272-53df5a51",
  "run_id": "20260708T232730272-53df5a51",
  "checkpoint_id": "nav-20260708T232730272-53df5a51",
  "state": "pass",
  "unresolved_blocking_count": 0,
  "blocking_finding_ids": [],
  "unsafe_reasons": [],
  "round_count": 1,
  "escalation_ref": null,
  "created_at": "2026-07-08T23:31:16Z"
}