{
  "schema_version": "1.0",
  "verdict_id": "verdict-run-manual-live-review",
  "run_id": "run-manual-live-review",
  "checkpoint_id": "manual-live-review",
  "state": "unsafe",
  "unresolved_blocking_count": 0,
  "blocking_finding_ids": [],
  "unsafe_reasons": [
    "timeout"
  ],
  "round_count": 1,
  "escalation_ref": null,
  "created_at": "2026-06-26T10:16:53Z"
}