{
  "schema_version": "1.0",
  "verdict_id": "verdict-20260711T130654230-af536802",
  "run_id": "20260711T130654230-af536802",
  "checkpoint_id": "nav-20260711T130654230-af536802",
  "state": "pass",
  "unresolved_blocking_count": 0,
  "blocking_finding_ids": [],
  "unsafe_reasons": [],
  "round_count": 1,
  "escalation_ref": null,
  "created_at": "2026-07-11T13:08:09Z"
}